[
  {
    "schema_version": "veritas.evidence_event.v1",
    "decision_id": "018f9b60-7e5a-7c40-9af3-4af9d7ccf001",
    "tenant_id": "tenant-example-001",
    "client_id": "client-app-001",
    "environment": "staging",
    "route": "/v1/inference/classify",
    "operation_type": "ai_inference",
    "model_provider": "google_vertex_ai",
    "model_id": "gemini-1.5-pro-002",
    "model_version": "002",
    "policy_snapshot_hash": "sha256:aaaaaaaaaaaaaaaaaaaaaaaaaaaaaaaaaaaaaaaaaaaaaaaaaaaaaaaaaaaaaaaa",
    "input_hash_sha256":    "sha256:bbbbbbbbbbbbbbbbbbbbbbbbbbbbbbbbbbbbbbbbbbbbbbbbbbbbbbbbbbbbbbbb",
    "output_hash_sha256":   "sha256:cccccccccccccccccccccccccccccccccccccccccccccccccccccccccccccccc",
    "final_hash":           "sha256:dddddddddddddddddddddddddddddddddddddddddddddddddddddddddddddddd",
    "canonicalization_algorithm": "RFC8785_JSON_CANONICALIZATION",
    "canonicalization_version": "1.0",
    "signature_algorithm": "ECDSA_P256_SHA256",
    "kms_key_version": "projects/example-project/locations/us-central1/keyRings/rex-guard/cryptoKeys/receipt-signing/cryptoKeyVersions/1",
    "signature_base64": "MEYCIQDEXAMPLE0000000000000000000000000000000000000000000000000000AiEA0000000000000000000000000000000000000000000000000000000000000000",
    "sequence_index": 1,
    "previous_hash": null,
    "current_hash": "sha256:dddddddddddddddddddddddddddddddddddddddddddddddddddddddddddddddd",
    "policy_decision": "ALLOW",
    "ledger_status": "sealed",
    "outbox_status": "not_required",
    "failure_code": null,
    "region": "us-central1",
    "runtime_ref": {
      "service": "rex-guard",
      "revision": "rex-guard-00042-abc",
      "image_digest": "sha256:deadbeef0000000000000000000000000000000000000000000000000000cafe",
      "commit_sha": "a1b2c3d4e5f6"
    },
    "latency_ms": 312,
    "created_at": "2026-05-02T10:00:00Z"
  },
  {
    "schema_version": "veritas.evidence_event.v1",
    "decision_id": "018f9b60-7e5a-7c40-9af3-4af9d7ccf002",
    "tenant_id": "tenant-example-001",
    "client_id": "client-app-001",
    "environment": "staging",
    "route": "/v1/inference/classify",
    "operation_type": "ai_inference",
    "model_provider": "google_vertex_ai",
    "model_id": "gemini-1.5-pro-002",
    "model_version": "002",
    "policy_snapshot_hash": "sha256:aaaaaaaaaaaaaaaaaaaaaaaaaaaaaaaaaaaaaaaaaaaaaaaaaaaaaaaaaaaaaaaa",
    "input_hash_sha256":    "sha256:eeeeeeeeeeeeeeeeeeeeeeeeeeeeeeeeeeeeeeeeeeeeeeeeeeeeeeeeeeeeeeee",
    "output_hash_sha256":   "sha256:ffffffffffffffffffffffffffffffffffffffffffffffffffffffffffffffff",
    "final_hash":           "sha256:1111111111111111111111111111111111111111111111111111111111111111",
    "canonicalization_algorithm": "RFC8785_JSON_CANONICALIZATION",
    "canonicalization_version": "1.0",
    "signature_algorithm": "ECDSA_P256_SHA256",
    "kms_key_version": "projects/example-project/locations/us-central1/keyRings/rex-guard/cryptoKeys/receipt-signing/cryptoKeyVersions/1",
    "signature_base64": "MEYCIQDEXAMPLE1111111111111111111111111111111111111111111111111111AiEA1111111111111111111111111111111111111111111111111111111111111111",
    "sequence_index": 2,
    "previous_hash": "sha256:dddddddddddddddddddddddddddddddddddddddddddddddddddddddddddddddd",
    "current_hash":  "sha256:1111111111111111111111111111111111111111111111111111111111111111",
    "policy_decision": "DENY",
    "ledger_status": "sealed",
    "outbox_status": "not_required",
    "failure_code": "AUTHORIZATION_DENIED",
    "region": "us-central1",
    "runtime_ref": {
      "service": "rex-guard",
      "revision": "rex-guard-00042-abc",
      "image_digest": "sha256:deadbeef0000000000000000000000000000000000000000000000000000cafe",
      "commit_sha": "a1b2c3d4e5f6"
    },
    "latency_ms": 48,
    "created_at": "2026-05-02T10:00:05Z"
  }
]
